{
  "schema_version": "1.0",
  "adventure_id": "The_Cold_Storage_Alarm",
  "initial_player_knowledge": [
    "KNOW-OPEN-ALARM",
    "KNOW-OPEN-CZ1-FAULT",
    "KNOW-OPEN-DEADLINE",
    "KNOW-OPEN-ROLE"
  ],
  "initial_world_state": {
    "control_escort_cleared": false,
    "archive_sync_complete": false,
    "dock_restricted_active": false,
    "security_unstaffed": false,
    "records_archive_queried": false,
    "manifest_reviewed": false,
    "label_residue_found": false,
    "bms_command_reviewed": false,
    "ready_to_accuse": false,
    "accusation_complete": false,
    "inference_badge_resolved": false,
    "inference_staging_resolved": false,
    "inference_relabel_resolved": false,
    "inference_control_resolved": false,
    "inference_culprit_resolved": false,
    "inference_perfect_resolved": false,
    "check_label_failed": false,
    "check_trend_failed": false,
    "it_records_route_used": false,
    "investigation_phase": 0
  },
  "initial_observable_entities": [
    "NPC-ELENA",
    "NPC-DEV",
    "NPC-PAT",
    "LOC-DOCK",
    "LOC-COLD"
  ],
  "playable_events": [
    {
      "event_id": "EVT-UNIT-DOCK-BASE",
      "unit_id": "UNIT-DOCK-BASE",
      "location_id": "LOC-DOCK",
      "physical_location_id": "LOC-DOCK",
      "event_kind": "location_hub",
      "structured_actions": [
        {
          "action_id": "ACT-DOCK-TALK-ELENA",
          "action_type": "approach_npc",
          "label": "Talk to Elena Morales.",
          "destination_unit_id": "UNIT-DOCK-ELENA-HUB",
          "requires_observable": [
            "NPC-ELENA"
          ]
        },
        {
          "action_id": "ACT-DOCK-GO-COLD",
          "action_type": "nav",
          "label": "Walk through the dock corridor to the cold storage hall.",
          "destination_unit_id": "UNIT-COLD-BASE"
        },
        {
          "action_id": "ACT-DOCK-TALK-WORKER",
          "action_type": "approach_npc",
          "label": "Talk to a dock worker.",
          "destination_unit_id": "UNIT-DOCK-WORKER-HUB",
          "requires_observable": [
            "NPC-PAT",
            "NPC-DEV"
          ]
        }
      ],
      "required_knowledge_ids": [],
      "relevant_knowledge_dependencies": [],
      "relevant_world_state_dependencies": [
        "dock_restricted_active",
        "ready_to_accuse"
      ],
      "observable_entities": [
        "NPC-ELENA",
        "NPC-DEV",
        "NPC-PAT"
      ]
    },
    {
      "event_id": "EVT-UNIT-DOCK-ELENA-HUB",
      "unit_id": "UNIT-DOCK-ELENA-HUB",
      "location_id": "LOC-DOCK",
      "physical_location_id": "LOC-DOCK",
      "event_kind": "npc_interaction",
      "structured_actions": [
        {
          "action_id": "ACT-ELENA-BEGIN",
          "action_type": "dialogue_topic",
          "label": "Ask where the investigation should begin.",
          "destination_unit_id": "UNIT-ELENA-BEGIN"
        },
        {
          "action_id": "ACT-ELENA-MAP",
          "action_type": "dialogue_topic",
          "label": "Ask whether a map or site overview is available.",
          "destination_unit_id": "UNIT-ELENA-MAP"
        },
        {
          "action_id": "ACT-ELENA-STAFF",
          "action_type": "dialogue_topic",
          "label": "Ask who was still on site working late.",
          "destination_unit_id": "UNIT-ELENA-STAFF"
        },
        {
          "action_id": "ACT-ELENA-RETURN",
          "action_type": "return",
          "label": "Return to the loading dock.",
          "destination_unit_id": "UNIT-DOCK-BASE",
          "exhaustion": "repeatable"
        }
      ],
      "observable_entities": [
        "NPC-ELENA"
      ]
    },
    {
      "event_id": "EVT-UNIT-DOCK-WORKER-HUB",
      "unit_id": "UNIT-DOCK-WORKER-HUB",
      "location_id": "LOC-DOCK",
      "physical_location_id": "LOC-DOCK",
      "event_kind": "npc_interaction",
      "structured_actions": [
        {
          "action_id": "ACT-WORKER-INCIDENT",
          "action_type": "dialogue_topic",
          "label": "Ask what they know about the incident.",
          "destination_unit_id": "UNIT-PAT-DOOR"
        },
        {
          "action_id": "ACT-WORKER-ROLE",
          "action_type": "dialogue_topic",
          "label": "Ask their name and role on site.",
          "destination_unit_id": "UNIT-WORKER-ROLE"
        },
        {
          "action_id": "ACT-WORKER-TENURE",
          "action_type": "dialogue_topic",
          "label": "Ask how long they have worked here.",
          "destination_unit_id": "UNIT-WORKER-TENURE"
        },
        {
          "action_id": "ACT-WORKER-LOCAL",
          "action_type": "dialogue_topic",
          "label": "Ask who or what they know locally.",
          "destination_unit_id": "UNIT-WORKER-LOCAL"
        },
        {
          "action_id": "ACT-WORKER-RETURN",
          "action_type": "return",
          "label": "Return to the loading dock.",
          "destination_unit_id": "UNIT-DOCK-BASE",
          "exhaustion": "repeatable"
        }
      ],
      "observable_entities": [
        "NPC-PAT",
        "NPC-DEV"
      ]
    },
    {
      "event_id": "EVT-UNIT-DOCK-BASE-SURVEYED",
      "unit_id": "UNIT-DOCK-BASE-SURVEYED",
      "location_id": "LOC-DOCK",
      "physical_location_id": "LOC-DOCK",
      "event_kind": "location_hub",
      "structured_actions": [
        {
          "action_id": "ACT-DOCK-TALK-ELENA",
          "action_type": "approach_npc",
          "label": "Talk to Elena Morales.",
          "destination_unit_id": "UNIT-DOCK-ELENA-HUB",
          "requires_observable": [
            "NPC-ELENA"
          ]
        },
        {
          "action_id": "ACT-DOCK-GO-COLD",
          "action_type": "nav",
          "label": "Walk through the dock corridor to the cold storage hall.",
          "destination_unit_id": "UNIT-COLD-BASE"
        },
        {
          "action_id": "ACT-DOCK-TALK-WORKER",
          "action_type": "approach_npc",
          "label": "Talk to a dock worker.",
          "destination_unit_id": "UNIT-DOCK-WORKER-HUB",
          "requires_observable": [
            "NPC-PAT",
            "NPC-DEV"
          ]
        },
        {
          "action_id": "ACT-UNIT-BREAK-BASE",
          "action_type": "nav",
          "label": "Head inside to the staff break room.",
          "destination_unit_id": "UNIT-BREAK-BASE",
          "requires_knowledge_ids": [],
          "requires_world_state": {},
          "referenced_fact_ids": [],
          "investigative": false
        },
        {
          "action_id": "ACT-UNIT-SECURITY-BASE",
          "action_type": "nav",
          "label": "Cut through the warehouse corridor to the security office.",
          "destination_unit_id": "UNIT-SECURITY-BASE",
          "requires_knowledge_ids": [],
          "requires_world_state": {},
          "referenced_fact_ids": [],
          "investigative": false
        },
        {
          "action_id": "ACT-UNIT-MANAGER-BASE",
          "action_type": "nav",
          "label": "Take the office wing corridor to the warehouse manager office.",
          "destination_unit_id": "UNIT-MANAGER-BASE",
          "requires_knowledge_ids": [],
          "requires_world_state": {},
          "referenced_fact_ids": [],
          "investigative": false
        },
        {
          "action_id": "ACT-UNIT-DOCK-BRIEFING-MENU",
          "action_type": "action",
          "label": "Review the supervisor briefing area.",
          "destination_unit_id": "UNIT-DOCK-BRIEFING-MENU",
          "requires_knowledge_ids": [],
          "requires_world_state": {},
          "referenced_fact_ids": [],
          "investigative": false
        },
        {
          "action_id": "ACT-UNIT-ESCORT-GRANTED",
          "action_type": "action",
          "label": "Request escort clearance to the automation control room.",
          "destination_unit_id": "UNIT-ESCORT-GRANTED",
          "requires_knowledge_ids": [
            "KNOW-OPEN-ORIENT"
          ],
          "requires_world_state": {},
          "referenced_fact_ids": [],
          "investigative": false
        },
        {
          "action_id": "ACT-SC-DOCK-ARRIVAL",
          "action_type": "scene",
          "label": "Receive supervisor briefing at the loading dock.",
          "destination_unit_id": "SC-DOCK-ARRIVAL",
          "requires_knowledge_ids": [],
          "requires_world_state": {},
          "referenced_fact_ids": [],
          "investigative": false
        },
        {
          "action_id": "ACT-SC-DOCK-INITIAL-SURVEY",
          "action_type": "scene",
          "label": "Survey the dock and adjacent corridors.",
          "destination_unit_id": "SC-DOCK-INITIAL-SURVEY",
          "requires_knowledge_ids": [],
          "requires_world_state": {},
          "referenced_fact_ids": [],
          "investigative": false
        },
        {
          "action_id": "ACT-SC-ACCUSATION-PREP",
          "action_type": "scene",
          "label": "Prepare final accountability documentation before the compliance threshold.",
          "destination_unit_id": "SC-ACCUSATION-PREP",
          "requires_knowledge_ids": [],
          "requires_world_state": {
            "ready_to_accuse": true
          },
          "referenced_fact_ids": [],
          "investigative": false
        }
      ],
      "variant_of": "UNIT-DOCK-BASE",
      "supersedes_unit_id": "UNIT-DOCK-BASE",
      "required_knowledge_ids": [
        "KNOW-OPEN-ORIENT"
      ],
      "relevant_knowledge_dependencies": [
        "KNOW-OPEN-ORIENT",
        "KNOW-BMS-COMMAND"
      ],
      "relevant_world_state_dependencies": [
        "dock_restricted_active",
        "control_escort_cleared"
      ]
    },
    {
      "event_id": "EVT-UNIT-DOCK-BASE-RESTRICTED",
      "unit_id": "UNIT-DOCK-BASE-RESTRICTED",
      "location_id": "LOC-DOCK",
      "physical_location_id": "LOC-DOCK",
      "event_kind": "location_hub",
      "structured_actions": [
        {
          "action_id": "ACT-DOCK-TALK-ELENA",